{
    "hrefTypes": [
        "Empty",
        "Media"
    ],
    "postTypes": [
        "page",
        "post",
        "home",
        "front"
    ],
    "cssClassesToSearch": [
        "wp-block-image",
        "wp-block-media-text",
        "wp-block-video",
        "postie-image",
        "wp-block-embed-youtube",
        "wp-block-post-featured-image",
        "featured-media"
    ],
    "excludeIDs": [
        0
    ],
    "rewriteScope": "body"
}